,State,RegionName
414,Rhode Island,"Providence (Brown University, (University of Rhode Island), Rhode Island School of Design, Johnson and Wales University, Providence College, Community College of Rhode Island, Rhode Island College, and Roger Williams University.)"
415,South Carolina,Central (Southern Wesleyan University)[2]
416,South Carolina,"Charleston (College of Charleston, The Citadel, MUSC)"
417,South Carolina,Clemson (Clemson University)[2]
418,South Carolina,Clinton (Presbyterian College)
419,South Carolina,Columbia (University of South Carolina)[14]
420,South Carolina,Due West (Erskine College)
421,South Carolina,Florence (Francis Marion University)
422,South Carolina,Greenwood (Lander University)
423,South Carolina,"Orangeburg (South Carolina State University, Claflin University)[2]"
424,South Carolina,Rock Hill (Winthrop University)
425,South Carolina,"Spartanburg (Wofford College, Converse College, University of South Carolina Upstate, Spartanburg Methodist College, Edward Via College of Osteopathic Medicine, Spartanburg Community College, Virginia College, Sherman College of Chiropractic)"
426,South Dakota,Brookings (South Dakota State University)[2]
427,South Dakota,Madison (Dakota State University)
428,South Dakota,Spearfish (Black Hills State University)
429,South Dakota,Vermillion (University of South Dakota)[5]
430,Tennessee,Chattanooga (University of Tennessee at Chattanooga)
431,Tennessee,Collegedale (Southern Adventist University)
432,Tennessee,Cookeville (Tennessee Technological University)[2]
433,Tennessee,Harrogate (Lincoln Memorial University)[2]
434,Tennessee,Henderson (Freed-Hardeman University)[2]
435,Tennessee,Johnson City (East Tennessee State University)
436,Tennessee,Knoxville (University of Tennessee)
437,Tennessee,Martin (University of Tennessee at Martin)[2]
438,Tennessee,McKenzie (Bethel University)[2]
439,Tennessee,"Memphis (Christian Brothers University, LeMoyne-Owen College, Memphis College of Art, Memphis Theological Seminary, Rhodes College, Southern College of Optometry, Southwest Tennessee Community College, University of Memphis, University of Tennessee Health Science Center, Visible Music College)"
440,Tennessee,Murfreesboro (Middle Tennessee State University)[2]
441,Tennessee,"Nashville (Vanderbilt University, Belmont University, Tennessee State University, Lipscomb University, Fisk University, Aquinas College, Trevecca Nazarene University)"
442,Tennessee,Sewanee (Sewanee: the University of the South)[2]
443,Texas,"Abilene (Abilene Christian University, Hardin-Simmons University, McMurry University)"
444,Texas,Alpine (Sul Ross State University)[2]
445,Texas,"Austin (University of Texas at Austin, St. Edwards University, Huston-Tillotson University)[2]"
446,Texas,Beaumont (Lamar University)
447,Texas,Canyon (West Texas A&M University)[2]
448,Texas,College Station (Texas A&M University)[5]
449,Texas,Commerce (Texas A&M University–Commerce)[2]
450,Texas,Dallas (Southern Methodist University)
451,Texas,"Denton (University of North Texas, Texas Woman's University)[2]"
452,Texas,"Fort Worth (Texas Christian University, Texas Wesleyan University)"
453,Texas,Georgetown (Southwestern University)
454,Texas,Huntsville (Sam Houston State University)[2]
455,Texas,"Houston (University of Houston, Texas Southern University, Rice University, Houston Baptist University)"
456,Texas,Keene (Southwestern Adventist University)[2]
457,Texas,Kingsville (Texas A&M University–Kingsville)[2]
458,Texas,"Lubbock (Texas Tech University, Lubbock Christian University)"
459,Texas,Nacogdoches (Stephen F. Austin State University)[2]
460,Texas,Plainview (Wayland Baptist University)[2]
461,Texas,Prairie View (Prairie View A&M University)[2]
462,Texas,San Marcos (Texas State University)[5]
463,Texas,Stephenville (Tarleton State University)[2]
464,Texas,Waco (Baylor University)
465,Utah,Cedar City (Southern Utah University)[2]
466,Utah,Logan (Utah State University)[2]
467,Utah,Provo (Brigham Young University)[5]
468,Utah,Orem (Utah Valley University)
469,Utah,Salt Lake City (University of Utah)
470,Utah,Ephraim (Snow College)
471,Vermont,"Burlington (University of Vermont, Champlain College and Saint Michael's College)[2]"
472,Vermont,Castleton (Castleton State College)[2]
473,Vermont,Johnson (Johnson State College)[2]
474,Vermont,Lyndonville (Lyndon State College)[2]
475,Vermont,Middlebury (Middlebury College)[2]
476,Vermont,Northfield (Norwich University)[2]
477,Virginia,Blacksburg (Virginia Polytechnic Institute and State University)[5]
478,Virginia,Bridgewater (Bridgewater College)[2]
479,Virginia,Charlottesville (University of Virginia)[23]
480,Virginia,"Farmville (Longwood University, Hampden-Sydney College)[2]"
481,Virginia,Fredericksburg (University of Mary Washington)[2]
482,Virginia,"Harrisonburg (James Madison University, Eastern Mennonite University)[2]"
483,Virginia,"Lexington (Washington and Lee University, Virginia Military Institute)[2]"
484,Virginia,"Lynchburg (Lynchburg College, Randolph College, Liberty University, Central Virginia Community College)"
485,Virginia,Radford (Radford University)[2]
486,Virginia,Williamsburg (The College of William & Mary)[2]
487,Virginia,Wise (University of Virginia's College at Wise)[2]
488,Virginia,"Chesapeake (Averett University, DeVry University, Troy University, Tidewater Community College, Strayer University, Everest University, Sentera College of Health Sciences, St Leo University)[2]"
489,Washington,Bellingham (Western Washington University)
490,Washington,Cheney (Eastern Washington University)[2]
491,Washington,Ellensburg (Central Washington University)[5]
492,Washington,Pullman (Washington State University)[5]
493,Washington,"University District, Seattle (University of Washington)[5]"
494,West Virginia,Athens (Concord University)[2]
495,West Virginia,Buckhannon (West Virginia Wesleyan College)[2]
496,West Virginia,Fairmont (Fairmont State University)[2]
497,West Virginia,Glenville (Glenville State College)[2]
498,West Virginia,Huntington (Marshall University)[2]
499,West Virginia,Montgomery (West Virginia University Institute of Technology)[2]
500,West Virginia,Morgantown (West Virginia University)[2]
501,West Virginia,Shepherdstown (Shepherd University)[2]
502,West Virginia,West Liberty (West Liberty University)[2]
503,Wisconsin,Appleton (Lawrence University)
504,Wisconsin,Eau Claire (University of Wisconsin–Eau Claire)
505,Wisconsin,Green Bay (University of Wisconsin-Green Bay)
506,Wisconsin,"La Crosse (University of Wisconsin–La Crosse, Western Technical College, Viterbo University)[2]"
507,Wisconsin,Madison (University of Wisconsin–Madison)[2]
508,Wisconsin,Menomonie (University of Wisconsin–Stout)[2]
509,Wisconsin,"Milwaukee (Marquette University, University of Wisconsin–Milwaukee)"
510,Wisconsin,Oshkosh (University of Wisconsin–Oshkosh)
511,Wisconsin,Platteville (University of Wisconsin–Platteville)[2]
512,Wisconsin,River Falls (University of Wisconsin–River Falls)[2]
513,Wisconsin,Stevens Point (University of Wisconsin–Stevens Point)[2]
514,Wisconsin,Waukesha (Carroll University)
515,Wisconsin,Whitewater (University of Wisconsin–Whitewater)[2]
516,Wyoming,Laramie (University of Wyoming)[5]
